_id,Name,Star,Comment
658a8fb4c141e0258d59d57e,Gigi,3.0,"대사 한 줄 없는, 영화가 아닌 공연 다큐라고 생각해야함. 음악을 하는 사람이었으면 더 재밌었을지도? 색감도 예쁘고 정사각형 프레임으로 보는 것도 흥미로웠다.  진주 목걸이에 다홍색 립 하고싶어짐"
658a8fb4c141e0258d59d57f,yeetang,3.5,스크린으로 봐도 울림이 있었다.
658a8fb4c141e0258d59d580,강다목,4.0,(짝짝짝)
658a8fb4c141e0258d59d581,몰봐,4.0,"낭만, 흥취, 분위기와 바다가 흠뻑.\n그 시절 패션과 담배, 맥주, 아이스바도 인상적.\n\n몸을 들썩이지도, 박수를 치지도 못한다.\n즐겁고도 고통스러운 영화."
658a8fb4c141e0258d59d582,dani,4.0,"기분 좋게 나부끼는 바람, 아른대는 물결, 짙은 담배연기 같은 재즈 그리고 사람들"
658a8fb4c141e0258d59d583,임형순,3.5,sweet little sixteen 할때 춤추는 정장아저씨보고 진짜 스탱딩 마려웠음... 한강에서 야외상영해주면 피맥들고 바로 달려간다 진짜
658a8fb4c141e0258d59d584,박지영,3.5,"영화는 지나치게 좁은 쇼트로 필요 이상의 시간을 지속시켜 연주자들의 즉흥적인 퍼포먼스와 합이 중요한 재즈의 세계를 온전히 담아내지 못한다. 다만, 취재 대상으로 삼은 뮤지션들의 퍼포먼스가 그 자체로 가히 환상적이라 그러한 폐쇄성을 상당 부분 만회한다. 특히, 엔딩에 등장하는 마할리아 잭슨의 퍼포먼스는 실로 굉장하다."
658a8fb4c141e0258d59d585,leaves,4.0,청각적인 부분은 물론 시각적으로도 탁월하다.
658a8fb4c141e0258d59d586,공씨,3.5,이렇게 극장에서 미동도 않고 보고 있는 모두의 모습이 너무나 웃겼다.. 마치 블랙코메디의 한 장면처럼.\n\n음...이게 이럴 게 아닌데...\n다들 속으로 그렇게 생각하며 앉아있었을듯.\n.\n.\n.\n.\n.\n.\n.\n.\n.\n코딱지만큼이라도 재즈에 대해 알았더라면 훨씬 더 좋았을텐데.
658a8fb4c141e0258d59d587,MOON people,3.5,"타임머신을 타고\n1958년 로드 아이랜드의 재즈 페스티벌이 열리는 곳으로\n툭, 떨어졌다.\n\n재즈에 대해 지식이 많지 않지만\n연주자들과 가수들의 모습을 짧게나마 보고 있자니\n아, 저런 사람들이 음악을 하기 위해\n태어난 사람들이구나! 하는 생각이 들었다.\n\n유행이 돌고 돈 것인지\n관객들 패션도 어찌나 힙하던지\n분명 의도되지 않은 모습들인데\n다들 각자의 작품 속 주인공처럼\n반짝반짝 빛났다.\n\n무의식적으로 어떤 사건 사고가 펼쳐지지 않는지\n기다리는 어리석은 내가 있었던 것은 비밀로 하자."
658a8fb4c141e0258d59d588,키매영,4.0,"아휴 하품난다. 언제쯤 끝나려나, 하면서\n손꾸락 발꼬락은 선율에 맞춰 까딱까딱 들썩들썩\n\n아니타 오데이의 스위트 조지아 브라운이 나올 때쯤엔\n아티스트 발견! 하고 내적 환호.\n집에 돌아오는 길에\n자꾸자꾸 내 플레이리스트를 채우는\n그때 그 사람들-\n\n(저도 야외상영 시급하다는 의견에 한표 더합니닷)"
658a8fb4c141e0258d59d589,고고티,4.5,"당장 뉴포트로 달려가고 싶게 만드는\n음악의  세계,  재즈의 향연"
658a8fb4c141e0258d59d58a,mandh,4.0,재즈와 함께 아름다운 시간여행. 그러나 극장에서 박수도 못치고 춤도 못추고 고통의 시간이었다. 플러스 진주 목걸이 사고 싶고 썬글라스 사고 싶고 빨간 스웨터 사고싶었삼
658a8fb4c141e0258d59d58b,서그종,3.5,앉아있기엔 아쉬운 다큐멘터리
658a8fb4c141e0258d59d58c,Nobody’s watching,4.0,내 묘비에 틀어놓고 싶다
658a8fb4c141e0258d59d58d,채정우,4.0,9/12 쿠씨네에서 관람\n\n영화보다는 재즈페스티벌 공연 실황을 보는 느낌. 재즈가 흘러나오는 50년대의 여유로운 여름밤으로 시간 여행한 기분이다.
658a8fb4c141e0258d59d58e,윤아킴,보고싶어요,잠들었음…
658a8fb4c141e0258d59d58f,양건,3.0,재즈를 즐긴 관객분들이\n진정한 승리자입니다
658a8fb4c141e0258d59d590,정인,3.0,지금의 나는 느끼지 못 할 낭만이 있던 시절
658a8fb4c141e0258d59d591,굴굴꿀꿀,0.5,나한테 영화는 스토리가 잇어야 되는데 이건 영화가 아님
658a8fb4c141e0258d59d592,김연준,4.0,꿈만 같은 순간
658a8fb4c141e0258d59d593,leslie,3.5,특별한 생각이나 부담없이 평온하게 즐길 수 있다
658a8fb5c141e0258d59d594,JJJ,3.5,한여름밤의 재즈 그리고 젊음의 열기
658a8fb5c141e0258d59d595,기비,3.5,자유롭게 춤추는 사람들 속에 섞이고 싶었다. 아쉬운 마음에 발만 까딱까딱.\n아티스트도 관객도 그걸 보는 나도 무아지경. 너무도 빨리 지나가버린 90분.
658a8fb5c141e0258d59d596,종달잉,4.0,재즈입문기
658a8fb5c141e0258d59d597,이돌린,4.0,나애 미드나잇 인 재즈
658a8fb5c141e0258d59d598,김경규,3.5,"다른 시대와 세계의 야만과 낭만, 동경"
658a8fb5c141e0258d59d599,이용철 평론가 봇,4.0,"안 보면 후회할, 이미 클래식이 된 음악영화"
658a8fb5c141e0258d59d59a,꾸꾸,보고싶어요,울산에 상영 안해주면 영화관 폭팔 시켜버릴것 ĭ˄ĭ
658a8fb5c141e0258d59d59b,탄호빵,4.0,그저 공연 실황 영상일수도 있다. 하지만 전설들과 함께한 재즈라면 그건 단순한 공연을 넘어서 영화가 된다.
658a8fb5c141e0258d59d59c,우히,3.0,대한극장 루프탑에서 모기에게 헌혈하며 봤었다
658a8fb5c141e0258d59d59d,박지윤,4.0,오늘날 우리는 너무 많은 자극에 노출되어 있는지도 모르겠다. 일렁이는 바다와 사람들의 얼굴. 그 모든게 좋았다.(BIFF)
658a8fb5c141e0258d59d59e,냐옹,3.0,여러모로 힐링
658a8fb5c141e0258d59d59f,이양,5.0,"내가 재즈를 좋아하는 이유는\n영혼의 깊이감이 있다\n영혼의 울림,\n그 느림 속에\n그냥 뱉는 가사 아닌\n마음 담아야만 나올 수 있는 울림\n슬픈 가사와는 어울리지 않는\n덤덤한 표정,\n악기들의 흔들리는 몸동작의 리듬\n리듬의 몸을 맡겨\n묵직한 베이스\n휘날리는 피아노\n숨을 한참을 참아야만 하는 색소폰\n숨을 죽이듯 한참을 바라본다\n그 기다림은 플랭크를 하는 1분처럼 길게 느껴진다\n몸을 힘을 실어 쿵쾅쿵쾅 드럼\n그 속에 잔잔한 드럼 브러시\n한 사람만이 이루어 낸 게 아닌\n함께 숨을 죽여 서로를 드러내지 않을 때의 조화로움\n그 속의 드러나는 울림의 소리가\n가사들이 내 마음을 울린다.\n\n내가 생각하는,\n재즈를 좋아하는 사람은,\n마음의 여유가 있어 기다릴 줄 알고\n사람을 배려할 줄 안다.\n고전과 전통에 깊이감이 있어 빈티지의 가치를 알고\n자유를 즐기는 자신만의 낭만을 삶을 사는 사람들이다. 그러기에 다른 사람의 다름을 판단하지 않고 존중해 주는 미덕, 율법에 사람을 규율하지 않는다. 그 판단은 자신이 하는 게 아니라는 것을 아는 사람이다.\n\n한여름밤의 재즈를 영화 엔딩 자막이 올라 오는 순간\n우리들은 약속했던 사람들처럼\n숨을 죽이며, 미동도 없이 그 자리에 남아 있었다.\n참 신기했다. 수 없이 영화를 보러 영화관에 갔었지만, 살면서 이런 모습을 보는 건 처음이었다.\n많은 사람이 감동하고 벅찬 영화라 잠시지만 잠깐을 여운의 시간으로 함께 했다.\n\n내가 살아가면서 함께 하고 싶은 사람은\n어쩌면 이런 사람들이라는 것을 느낀다."
658a8fb5c141e0258d59d5a0,hae,3.5,재즈에 의한\n재즈를 위한\n재즈로 인한\n\n모든 것이 재즈여서\n완벽했던 여름 날
658a8fb5c141e0258d59d5a1,쩜순,4.0,한여름밤의 둠칫둠칫!
658a8fb5c141e0258d59d5a2,문화예술로 연명 중,3.5,"와… 그 시절에도 촬영, 녹음이 이렇게 기깔날수있었구나 이런 작품이야말로 야외상영을 해야함\n\n괴물 대신 봤는데 후회는 없다.."
658a8fb5c141e0258d59d5a3,김현경,3.5,김민주 gv
658a8fb5c141e0258d59d5a4,정재린,5.0,우리 나중에 그 카페에서 온종일 뉴포트를 띄어두고 여름을 보내자.
658a8fb5c141e0258d59d5a5,Youngdae Seo,4.0,좋아하는 사람과 페스티벌에 참가한 하루. 노을이 아름다운 하루였고 옆에서 곤히 잠든 모습이 사랑스러웠다.
658a8fb5c141e0258d59d5a6,박채은,3.5,영화로 보기보다는 그냥 늘상 저녁 먹을 때쯤이면 틀어놓고 싶다. 영화관에서 보려니 영상 속 관객이 너무 부럽기만 했다
658a8fb5c141e0258d59d5a7,다정한무관심,4.0,러닝타임 동안 1958년의 뉴포트에 있었다.
658a8fb5c141e0258d59d5a8,미풍,3.0,재즈를 좋아하는 사람에겐 최고의 영화일 듯 싶다. 특히 콘트라베이스 치면서 마을 풍경 보여주는 장면이 인상깊었다. 그리고... 너무 잘 잤다. 재즈는 잠 자기 아주 좋은 음악인 듯
658a8fb5c141e0258d59d5a9,여덟,3.5,자라섬 재즈 페스티벌 가고싶다.
658a8fb5c141e0258d59d5aa,MONARCH,4.0,이걸 맥주도 없이 상영관 안에서 조용히 보라는건 고문 아닙니까\n루이 암스트롱은 괜히 재즈의 아버지로 불리는게 아니다 여유에서 뿜어져나오는 아우라는 관객을 완벽하게 휘어잡아버린다
658a8fb5c141e0258d59d5ab,정민기,3.5,페스티벌에선 음악만이 중요한 게 아니다
658a8fb5c141e0258d59d5ac,비토,2.5,(아무 소리도 내지 못 하고 리듬을 타지도 못하니) 이렇게 보니까 재즈스럽지 않았다.
658a8fb5c141e0258d59d5ad,Eva.j,3.0,"루이 암스트롱이 트럼펫도 부는지 처음 알았네.\n재즈는 신기하다. 재즈의 시대는 가버렸는데도, 이렇게 50년대 화면을 복원했는데도. 촌스럽다거나 고여있다는 느낌이 들지 않는다. 그냥 쿨해. 왜 그렇지?\n바닷물은 매 순간 흘러가는데도, 부서지는데도, 일그러지는데도. 없어지지 않고 그자리에 있는 것 같이.\n\n맥주한잔 하며 춤추면서 사랑하는 사람과 보고싶네.\n\n2022.09.28, 라이카시네마"
658a8fb5c141e0258d59d5ae,전승호,4.0,기록하는 행위의 위대함
658a8fb6c141e0258d59d5af,tu,5.0,멋진무대와 아름다운 풍경 그것을 만끽하는 사람들.\n이 영상을 남겨 지금 내가 볼 수 있음에 감사한다.\n함께 즐기고 웃을 수 없는게 아쉬울 따름
658a8fb6c141e0258d59d5b0,B바라기,3.5,맥주를 곁들이고픈 심신안정제
658a8fb6c141e0258d59d5b1,송예준,4.0,2022년 서울 종로에서 재즈 페스티벌이 열렸던 1959년 미국 뉴포트로 점프. 분위기는 격없이 자유로웠고 뉴포트 정말 아름다웠고 고막에는 꿀이 찼어요. 한 시간 반 동안 행복했어요.
658a8fb6c141e0258d59d5b2,성태훈,보고싶어요,째애애즈란 말이죵
658a8fb6c141e0258d59d5b3,nordan,4.0,"영화관이 아니라 잔디밭 또는 어둑어둑한 조명의 와인바에서, 재즈 선율에 목이 타 마시는 생수가 아니라 적당한 알코올과 함께였다면 더욱 좋았을 영화."
658a8fb6c141e0258d59d5b4,예원_,2.5,재즈는 좋았지만 이걸 영화라 부를 수 있을까.
658a8fb6c141e0258d59d5b5,돼지팬클럽,2.0,이 영화는 옛날 재즈공연을 모아둔 영화다. 끝\n재즈란 말이죠\n수빱두비두밥 두비두밥
658a8fb6c141e0258d59d5b6,Fitz,4.0,재즈를 사랑할 수 밖에 없는 이유
658a8fb6c141e0258d59d5b7,BJY,4.0,재즈와 윤슬에 취한다
658a8fb6c141e0258d59d5b8,로치,3.0,좋은데 졸림
658a8fb6c141e0258d59d5b9,bn,3.5,시청각의 '예술'을 담아낸 야외에서 봐야하는 영화 1위.
658a8fb6c141e0258d59d5ba,해파리,2.5,All of me 연습해야지~
658a8fb6c141e0258d59d5bb,강응찬,3.0,영화 보는 느낌이 아니라 행사를 다녀온 느낌
658a8fb6c141e0258d59d5bc,서동현,4.0,관객이 영화의 주인공처럼 나온다. 페스티벌에 있는 모두가 주인공인 멋진 영화. 쉴 새 없이 흐르는 음악에 가만히 감상만하기엔 너무 아까운 영화다.
658a8fb6c141e0258d59d5bd,Valen,5.0,재즈 공연 보면서 가만히 있어야하는게.... 첫 시작부터 위기엿다........ 야외상영해달라고....... 했잖아요.....................
658a8fb6c141e0258d59d5be,Joewon Yoon,4.0,"Lives가 즐긴다, 고 번역되었다는 사실"
658a8fb6c141e0258d59d5bf,김밥,4.5,재즈를 잘 모르지만 참말로 즐길 수 있게 해준 영화
658a8fb6c141e0258d59d5c0,키시베,3.5,웃어넘기는 실수마저 재즈가 되는\n그 시간이 참으로 부럽구나.
658a8fb6c141e0258d59d5c1,네원,3.5,재즈가 뭐라고 생각하세요? 후하 이 영화를 대한극장 후프탑 야외상영으로 늦여름의 마지막에 살갗을 스치는 셔츠를 입고 맥주를 마시며 보다니 나는 행운아야!
658a8fb6c141e0258d59d5c2,윤홍민,4.5,All the cats wanna dance with sweet little sixteen
658a8fb6c141e0258d59d5c3,지인,4.0,"장면 하나하나가 너무 이쁨. 재즈 음악도 좋아서 보면서 남모르게 발을 굴렀다. 빔프로젝터를 구매한다면 여름밤에 매일 틀어놓고 싶은 영화!\n\n사실 영화가 좋기도 했지만 대한극장 옥상에서 야외상영회로 본 경험이 너무 좋았다. 적당하게 부는 바람과 풀벌레 소리, 맥주 한 캔의 추억은 절대 못 잊을듯🥹"
658a8fb6c141e0258d59d5c4,JCKR,3.5,한여름밤의 재즈ㆍ37ㆍ재즈같은 관객
658a8fb6c141e0258d59d5c5,originew,3.5,영화 속 청중이 되어 기립 박수 치고 싶은 순간의 연속.
658a8fb6c141e0258d59d5c6,weihnachten,3.5,"85분간 그야말로 쉴새없이 이어지는 재즈, 음악의 향연."
658a8fb6c141e0258d59d5c7,심재,4.0,소름이 돋은채로 내적댄스 추느라 시간가는줄 몰랐다
658a8fb6c141e0258d59d5c8,미안해요 래리(이성현),4.0,그 시대의 낭만을 생생하게 담아낸 것만 해도 최소 4점.
658a8fb7c141e0258d59d5c9,김윤섭,5.0,내적 댄스를 이겨내지 못하고 스윙해버렸다. 극장안에서.\n야외 상영하면 또 보러 갈거다. 박수치러.
658a8fb7c141e0258d59d5ca,온,3.0,"대단한 찬사를 받을 정도인지는 모르겠음ㅠㅠ근데 콘서트 다큐멘터리 시작점이라고 하니까 이게 있었으니까 후대에 점점 더 발전해 온거겠지?\n색감은 진짜 아름다웠다. 빈티지샵에서 봤던 드레스들 입고 공연하는 디바들🖤 공연 즐기는 관객들까지 얼굴 잡히는 사람만 계속 잡히던데 반할뻔 했어요 언니들\n유튜브에도 공연 영상 몇 개는 있던데 물론 화질은 떨어지지만,, 상영 환경이 집보다 백 배 좋은 곳에서 보는 게 아니라면 글쎄다.. 사운드 특화관에서 상영하는 것도 아니라서 좀 아쉬움"
658a8fb7c141e0258d59d5cb,박도훈,3.0,한 없이 행복해보이는 그들의 표정을 보는 것만으로도…
658a8fb7c141e0258d59d5cc,황미정,5.0,너무예쁘다
658a8fb7c141e0258d59d5cd,17171771,4.0,과제 안하고 이거 보길 잘했다..
658a8fb7c141e0258d59d5ce,김동현,4.0,"59년 여름, 바람은 선선하게 불고 흰 포말을 일으키는 파도를 보면서 사람들은 웃었어. 다 녹아 문드러져 미지근한 맥주를 마시지. 느긋하게 지나가는 차 안에서 재즈 연주자들의 연주가 들렸고 그게 썩 좋았어."
658a8fb7c141e0258d59d5cf,billi1air,4.0,극장(劇場)과 시네마가 지금 우리에게 줄 수 있는 모든 것
658a8fb7c141e0258d59d5d0,woozi,3.5,좋다 졸리다 좋다 졸리다 좋다 끝\n\n좋긴 한데 졸려
658a8fb7c141e0258d59d5d1,Kwon,3.5,페스티벌이 벌어지는 도시의 공기까지 잡아내 더 진하게 다가오는 공연실황.
658a8fb7c141e0258d59d5d2,WatchaPedia,3.5,일부가 되어 재즈를 사랑하게 되어버림
658a8fb7c141e0258d59d5d3,개가오,4.0,"당시의 재즈는 찰나의 화합이었다.\n\n온갖 차별이 만연하던 시기에 인종과 성별\n그리고 사회적 지위 상관 없이 남녀노소 재즈를 즐기러 온다.\n\n텍스트도 대사도 필요없이 그저 페스티벌을 즐기러 온\n관객들을 비추는 것 만으로도 충분히 알 수 있었다.\n\n현대의 휴대전화는커녕 워크맨조차 없었을 시기로\n특정한 곳에서만 사용할 수 있는 커다란 기계\n\n그것도 현장감, 제대로 된 음질로 음악을 즐길 수 없는 시대엔\n이런 페스티벌이 간절했을 것이다.\n\n그래서 그런지 춤, 연인과 스킨쉽, 취했다 싶을 정도로\n음악을 느끼고 열정적인 관객이 눈에 띄었다.\n\n재즈에는 농담이 있고 가벼운 장난이 있으며\n풍자와 공감이 있기에 재즈는 소통이고 일상을 담은 음악 같았다.\n\n이를 증명하듯 본 작품은 아티스트의 경연 속에 관객을 비춤과 동시에\n일상과 휴식 그리고 인생을 즐기러 온 사람들을 보여주면서\n재즈가 삶 속에 녹아들어 함께한다는 것을 묘사했다.\n\n다소 투박해 보이는 연출일진 몰라도\n재즈의 근간과 음악적 파급력이 자연스레 두드러졌고\n\n삶의 무게 그리고 사회, 정치에서 잠시나마 벗어나\n그저 페스티벌을 즐기는 이들을 보며 재즈가 추구하는\n음악적 가치가 느껴질 수 있었다.\n\n현대의 대중 음악처럼 패턴과 장단이 또렷하고\n다채로운 음향 그리고 꽉 찬 느낌의 곡들은 아니지만\n\n해학적인 가사 그리고 아티스트만의 몸짓과 템포에\n신명나고 느낌 가득한 경연으로 작중 관객들과 함께\n\n나도 모르게 손가락으로 박자를 맞출 정도로 젖어들어 감상했다.\n\n물론 현대의 방대하고 꽉찬 느낌의 음향도 아니고\n지금의 성향에 맞춘 곡들과 거리가 있으며\n\n무엇보다 스토리텔링이 베재되어 있는\n공연 실황 다큐멘터리라 사람에 따라 지루할 수도 있다.\n\n그럼에도 80분가량의 적절한 러닝타임에 재즈뿐만 아니라\n로큰롤과 가스펠 장르까지 아우르면서 오로지 콘서트 음악에 집중해 있으니\n관심이 있다면 한 번쯤 봐도 좋을 만한 다큐멘터리였다.\n\n또한 1999년 미국 의회도서관 영구 보존 영화에\n근 63년 만에 국내에 정식 개봉한 영화로\n\n흑인 음악계 거장들의 경연을 볼 수 있어 여러모로 상징성이 있는 작품을\n극장의 스크린과 사운드로 감상할 수 있는 기회고\n\n음악계 종사자 분의 GV 소식도 간간히 들려오니\n영화팬 혹은 음악에 관심이 많다면 경험 삼아 봐도 좋을 것 같다."
658a8fb7c141e0258d59d5d4,얌얌,3.5,배경 음악 같은 영화
658a8fb7c141e0258d59d5d5,무지,3.0,"가 본 적 없지만 그리운 그 곳의 분위기와 온도, 음악."
658a8fb7c141e0258d59d5d6,홀리몰리,4.0,언제까지 어깨춤을 추게할거야 내 어깨를 봐 탈골됐잖아
658a8fb7c141e0258d59d5d7,다예,3.5,야외상영으로 봤더라면\n별 5개가 아깝지 않았을텐데...
658a8fb7c141e0258d59d5d8,Her Waii,4.0,여름의 막바지에서 함께할 수 있어 좋았다\n무엇보다 부르죠아들의 패션을 엿보는 재미도
658a8fb7c141e0258d59d5d9,다다단스,3.5,짧다 많이 짧다 그래서 싫다\n더 길어야 하는데
658a8fb7c141e0258d59d5da,yohoooooo,4.0,재즈의 다양성.\n이 세상의 모든 악기도 재즈의 일부가 될 수 있다.\n심지어 음치까지 수용할 수 있지 않을까.\n라이브 듣고 싶다.
658a8fb7c141e0258d59d5db,achu,5.0,눈으로 담아낼 수 있는 모든 낭만
658a8fb7c141e0258d59d5dc,민철홍,4.5,제작하고싶은 꿈의 축제
658a8fb7c141e0258d59d5dd,김진태,5.0,"주펄의 ""썁빠뚜비두바~""가 날 여기까지 이끌었다.\n할아버지 할머니 세대들의 페스티벌 즐기는 자세와 감성은 우리보다 더 나았던 거 같기도?"
658a8fb7c141e0258d59d5de,김문,5.0,사랑해
658a8fb7c141e0258d59d5df,다람쥐,4.0,딱 좋은 계절과 날씨에 야외상영으로 보게 되어 운이 정말 좋았다. 그런데 맥주가 빠져서 너무 너무 너무 아쉬웠음.
658a8fb7c141e0258d59d5e0,얕고넓게내취향나도모름,3.5,가을밤이었지만 야외 상영으로 본게 신의 한 수
658a8fb7c141e0258d59d5e1,조각,3.5,"낙엽이 다가오는, 바다의 계절 끝에 보면 이번 여름을 보내고 다음 여름을 기대하게될 것 같은"
658a8fb7c141e0258d59d5e2,심신진,,정말 재즈만 틀어주네
658a8fb8c141e0258d59d5e3,mango,4.0,8000원 내고 거장들의 콘서트츨 즐기디
658a8fb8c141e0258d59d5e4,황해달,3.5,영화같은 다큐
658a8fb8c141e0258d59d5e5,왕껨짱,5.0,사운드 좋은 극장에서 못본 것이 한이야
658a8fb8c141e0258d59d5e6,Sungwoo Yoon,4.0,낭만가득 그 시절 페스티벌의 풍경과\n재즈거장들의 실연들
658a8fb8c141e0258d59d5e7,runmelo_,5.0,후덥지근한 공연장으로 데려가준다
658a8fb8c141e0258d59d5e8,꽃돔,3.0,마림바소리 넘좋아
658a8fb8c141e0258d59d5e9,정후중,3.5,과거의 싱그러움과 즐거움을 배달하는 뮤직비디오 (23. 3. 시리즈온)
658a8fb8c141e0258d59d5ea,찜닭😚,5.0,영화 좋은데 졸릴 때 보면 잘 거 같아서 쌩쌩할 때 가야대
658a8fb8c141e0258d59d5eb,ong,3.5,보면 정신이 몽롱해짐 ..\nzz 불면증이신 분 추천
658a8fb8c141e0258d59d5ec,gamja!,3.0,이걸 영화관에서 조용히 앉아서 가만히 봐야한다는 게 고역이었다
658a8fb8c141e0258d59d5ed,클래시네마 (유튜브),3.0,"* 3줄 리뷰\n\n1. 재즈팬이 아니어도 느낄 수 있는, 보편 상식의 아름다움이 있다.\n\n2. 그들의 얼굴에서, 천국이 어렴풋하게.\n\n3. 비몽사몽 눈감고 봐도 좋은, 편안한 품."
658a8fb8c141e0258d59d5ee,필네씨,2.5,"재즈에 대한 관망, 열정 그리고 메시지 그 자체."
658a8fb8c141e0258d59d5ef,Kingsofcompassion,4.0,와 한 여름밤의 꿈을 꾸고 나온 기분
658a8fb8c141e0258d59d5f0,영화볼때만ㅜ는남자,5.0,"재즈의 순수한 형태가 60년이라는 세월을 지나\n날것 그대로의 모습으로 고스란히 담겨있다.\n\n다큐멘터리인 이 영화는 1958년 뉴포트재즈페스티벌의\n실황을 인터뷰 장면 없이 있는 그대로 담았다.\n미국 뉴포트 해안가의 여유로운 여름날의 모습,\n재즈 페스티벌을 위해 모인 들뜬 사람들,\n그리고 재즈를 개척했던 전설적인 재즈 뮤지션들이\n한 곳에 모여 전하는 재즈의 진수.\n\n루이 암스트롱은 재즈 그 자체였고 인간이 재즈를 통해\n표현할 수 있는 것을 그 짧은 시간 안에 다 보여준 것만 같았다.\n이 영화에서는 재즈 뮤지션들의 퍼포먼스와 함께 관객들의\n다양한 리액션도 많이 담겨있는데 휴대폰이란 게 없던\n1958년의 관객들이 각자의 개성대로 온전히 재즈를 즐기는\n모습들이 참 흥미로웠다. 음악에 맞춰 춤추며 즐기는 관객들을 보다 보니 몇 해전 서울재즈페스티벌 다이앤 리브스 공연 때 잔디밭에서 신나게 춤추던 게 문득 떠올랐는데 아마 내가 그때 느꼈던 자유로움과 즐거움을 뉴포트의 관객들도 느꼈을 것 같다. 다른 게 있다면 그날 뉴포트에는 지금 생각해보면\n정말 말도 안 되는 엄청난 뮤지션들이 모여있었다는 것.\n\n영화를 보고 아쉬워 집에 와서 넷플릭스에 있는 마일스 데이비스 다큐를 봤는데 그도 그 페스티벌에 왔었다는 사실을 알게 됐다! 이렇게 연결점을 찾게 되니 반가웠고 그는 도대체 영화에 왜 안 나왔을까 궁금했고 그 당시 뉴포트재즈페스티벌은 정말 대단한 곳이었구나 한번 더 느끼게 됐다. 타임머신은 언제 개발되나.\n\n<놉> 다음으로 2022년 최고의 영화.\n재즈를 좋아한다면 꼭 봐야하는 영화."
658a8fb8c141e0258d59d5f1,박이삐삐,2.5,그 시대에 재즈 페스티벌을 그대로 짧게 다녀온 기분. 즐거운 재즈 관람시간. 영화라고 하기에는 현장 스케치 같은 느낌.
658a8fb8c141e0258d59d5f2,이십칠,3.5,재즈가 뭐라고 생각하세요?
658a8fb8c141e0258d59d5f3,靑ㅤ,4.5,내러티브가 있는 영화가 아니라 재즈를 담은 필름에 가까움 진짜 아름… 아름답다 음악이란 건\n재즈란 순간을? 사는 것이군요? 즐거움과 편안함과\n자연스러움이군요…
658a8fb8c141e0258d59d5f4,강노래,3.0,극장 안에 갇힌 페스티벌이 무슨 의미가 있을까?
658a8fb8c141e0258d59d5f5,Travis,보고싶어요,2022/9/5 소개
658a8fb8c141e0258d59d5f6,이진수,3.0,그들에겐 대화이자 우리들에겐 축제이며 축복이다
658a8fb8c141e0258d59d5f7,이태양,3.0,가치와 의미가 있는 볼만한 영화
658a8fb8c141e0258d59d5f8,변요섭,3.5,떠오르고 저무는 재즈 아래 하나가 된 어느 여름 날
658a8fb8c141e0258d59d5f9,한길,3.5,재즈를 사랑스럽고 귀엽게 느끼게 하는 순진한 그 시절.
658a8fb8c141e0258d59d5fa,개미똥,4.5,그 시절 멋쟁이들 왜 이렇게 많나요
658a8fb8c141e0258d59d5fb,유진,3.5,영화같은 순간이라고 느꼈을 그 때가 정말 영화가 된다면
658a8fb8c141e0258d59d5fc,노릿,2.5,제 코골이가 재지했다구요…죄송합니다ㅜㅠ
658a8fb9c141e0258d59d5fd,손성빈,3.5,이거 보고 레이밴 선글라스 구매 결심함.
658a8fb9c141e0258d59d5fe,cwone,4.0,박수치고싶어서 손 근질거림
658a8fb9c141e0258d59d5ff,고박호구마,2.5,‘이걸 영화라고 부를 수 있을까?’와\n‘이것이야말로 영화가 아닐까?‘ 사이에서 주저하게 된다.
