_id,Name,Star,Comment
658a8fb9c141e0258d59d600,vicky,3.0,"눈이 아닌 귀로 느끼는 영화. 야외에서 크게 틀어놓고  맥주한잔하며 들썩이며 보고싶은데 조용한 영화관에서 숨죽이고 보기엔 영 성에 안찬다. 루이암스트롱은 마치 재즈라는 자체를 사람으로 빚어놓은 것 같다. 마지막 가스펠에는 나도 모르게 울컥. 스토리도 없이, 스케치 영상 같은데 자유, 여유, 낭만의 시절.. 그때의 바이브가 느껴지게 만드는 음악과 소울, 목소리의 힘."
658a8fb9c141e0258d59d601,권기윤,3.0,아...음....무대는 좋긴 한데....\n영화로써의 가치는 딱히 없고 그냥 기록물 느낌...?
658a8fb9c141e0258d59d602,조조,3.5,낭만이 가득하다
658a8fb9c141e0258d59d603,카프리콘,3.0,재즈의 최잔성기 60년대로 가는 길목.\n음악은 충분히 만끽할 수 있으나 몇몇 관객의 반응 외에 다큐적 가치로는 한계를 느낀다.
658a8fb9c141e0258d59d604,양융,4.0,싱어롱 도입이 시급합니다…
658a8fb9c141e0258d59d605,고용호,4.5,어서 씨네큐브로\n2022.10.10.
658a8fb9c141e0258d59d606,Kiha,3.5,인생은 행복하게 떠들고 먹고 하다 가면 되는 것. 코르셋 한껏 조인 여자들 너무 예쁘다
658a8fb9c141e0258d59d607,전우성,4.0,가스펠만 빼줬다면 0.5점은 더 줬을 거야
658a8fb9c141e0258d59d608,곽동준,3.5,밤하늘에 스크린을 치고 누워서 보고픈 영화
658a8fb9c141e0258d59d609,Oholy,3.5,"적막으로 가득찬 영화관에서 흥을 절제하며 심장은 두근두근\n프레임에 가둬진, 일종의 영원의 순간을 보는 것\n\n한 발짝은 더 떨어져서 군상을 보니 오히려 좋았다\n\n마지막 곡의 전주를 들으면서 그래, 이거지\n재즈의 소울"
658a8fb9c141e0258d59d60a,징징,4.0,음악이 있다면 영원토록 영화같은 우리의 인생
658a8fb9c141e0258d59d60b,HunminJung,3.0,올해 재즈 페스티벌은 이걸로 갔다 왔다 치자.\n재즈 페스티벌을 갔다 온 사람들이 머릿 속에 추억하는 현장을 그대로 재현하면 이거.\n여름이었다....⭐️ 1시간 버전
658a8fb9c141e0258d59d60c,Serumo,3.5,정말 여름휴가에 재즈 페스티벌 와서 밤이 되도록 시간 가는 줄 모르고 공연 보는 기분이었다.
658a8fb9c141e0258d59d60d,eeHeaven,3.0,"영화관에서 볼 영화는 아닌 것 같다 ㅎ,,ㅎ\n근데 루이 암스트롱 넘 행복해보여서 나까지 기분 좋음"
658a8fb9c141e0258d59d60e,시연,3.0,영상이 음악을 듣지 않으니 기록물로써의 의미만 남게되었다.
658a8fb9c141e0258d59d60f,인주,4.0,보는 사람을 1958년의 그때 그 자리로 보내주는 재즈의 매력.
658a8fb9c141e0258d59d610,송씨네,4.0,재즈가 뭐라고 생각하세요? (주펄 주호민 님이 얘기하시긴 했는데) 이미 답은 나와 있지요. 1958년 로드아일랜드 주 남동부의 항구도시 뉴포트… 드넓은 바다가 보이는 이 곳에 차량 한 대가 질주하기 시작합니다. 악기와 사람을 태운 차량은 속도를 줄여 미친듯이 연주하지요. 그리고 그 뒤로 공연을 위한 전용 무대가 보입니다. 비어 있는 나무 접이의자는 조금씩 빈자리를 채워갑니다. 빅밴드의 연주로 시작된 무대는 중반으로 가는 시점에 척 베리가 아이돌처럼 칼군무 속에 록큰롤 무대를 선보이고 밤은 점점 깊어 옵니다. 슈퍼스타는 항상 끝판에 나오는 건 그 시기에도 그랬나 봅니다. 빅스타 두 명이 대미를 장식할 준비를 하죠. 첫 타자는 루이 암스트롱으로 노래도 잘하고 멋진 트럼펫 연주에 사람을 홀리고 웃게 만드는 만담 솜씨까지 만능이 따로 없지요. 대미를 장식한 사람은 마할리아 잭슨으로 가스펠의 여왕답게 온 힘을 다해 노래합니다. 1958년 뉴포트 재즈 페스티벌은 전설이 된 공연이죠. 1999년 미국 국회의사당에 동영상 자료가 영구 소장된데에는 다 이유가 있는 것이죠. 재즈는 결국 흥과 한을 포함한 감동까지 모두 느낄 수 있는 장르란 생각이 듭니다. 가스펠과 록큰롤은 이 장르의 뿌리가 되었고 흑인중심의 문화에서 점차 모든이들이 즐기는 음악이 되었죠. 스캣으로 애드리브를 펼치고 흥을 돋구는 것은 재즈가 가진 큰 장점이고요. 그리고 그 속에서 엘비스 프레슬리 같은 인물을 탄생시켰고요. 이 다큐는 1959년 다음해 이 공연실황을 선보이고 60주년이 되는 1999년에 디지털 리마스터링 되었죠. 비좁은 화면이지만 그럼에도 이 실황이 멋졌던 것은 열정을 다해 공연한 뮤지션들 때문이 아닐까 생각됩니다. 초반 시큰둥한 관객들의 표정도 예열 과정의 일부였고요. 어쩌면 그 시절의 음악들이 사랑받고 더 다양한 장르로 확대되며 우스스탁이 생겨났고 라이브 에이드 같은 거대한 쇼가 생겨난게 아닐까란 생각도 해보게 됩니다.
658a8fb9c141e0258d59d611,해와,3.5,재즈 콘서트 잘 즐기다 갑니다.
658a8fb9c141e0258d59d612,ㅇㅈ,3.5,누군가와 함께 화이트와인을 마시며 즐기고 싶은 딱 그런 영화.
658a8fb9c141e0258d59d613,유고은,0.5,옛날 재즈 공연을 단순 짜깁기 한 줄 모르고 봤는데 대체로 지루했음
658a8fb9c141e0258d59d614,zerosugar,4.0,어떻게 이 영화를 가만히 앉아서 보게 할 수가 있어요
658a8fb9c141e0258d59d615,Osborme,3.5,시절이 사람을 맨든다고 58년의 청춘들이 22년의 내보다 더 인생을 잘 즐기시는듯. 휴양지룩도 멋지고 다양한 계층의 사람들이 자기식대로 음악을 즐기는 것도 보기 좋더라. 아 물론 음악도.
